id,title,link,date
1001,Cloud at the Edge,https://www.ibm.com/cloud/blog/cloud-at-the-edge,2/26/19
1002,Rounding out the Edges,https://www.ibm.com/cloud/blog/rounding-out-the-edges,5/7/19
1003,Architecting at the Edge,https://www.ibm.com/cloud/blog/architecting-at-the-edge,10/21/19
1004,DevOps at the Edge,https://www.ibm.com/cloud/blog/devops-at-the-edge,12/3/19
1005,Policies at the Edge,https://www.ibm.com/cloud/blog/policies-at-the-edge,1/22/20
1006,Security at the Edge,https://www.ibm.com/cloud/blog/security-at-the-edge,5/12/20
1007,Analytics at the Edge,https://www.ibm.com/cloud/blog/analytics-at-the-edge,6/8/20
1008,5G at the Edge,https://www.ibm.com/cloud/blog/5g-at-the-edge,11/12/20
1009,Clusters at the Edge,https://www.ibm.com/cloud/blog/clusters-at-the-edge,12/9/20
1010,Automation at the Edge,https://www.ibm.com/cloud/blog/automation-at-the-edge,2/18/21
1011,Network Slicing at the Edge,https://www.ibm.com/cloud/blog/network-slicing-at-the-edge,4/1/21
1012,Data at the Edge,https://www.ibm.com/cloud/blog/data-at-the-edge,6/4/21
1013,Architectural Decisions at the Edge,https://www.ibm.com/cloud/blog/architectural-decisions-at-the-edge,7/26/21
1014,GitOps at the Edge,https://www.ibm.com/cloud/blog/gitops-at-the-edge,11/2/21
1015,Cloud Services at the Edge,https://www.ibm.com/cloud/blog/cloud-services-at-the-edge,12/20/21
1016,How to Integrate IBM Cloud Code Engine with IBM Git,https://www.ibm.com/cloud/blog/how-to-integrate-ibm-cloud-code-engine-with-ibm-git,1/20/22
1017,Bandwidth Allocation in Virtual Server Instances,https://www.ibm.com/cloud/blog/bandwidth-allocation-in-virtual-server-instances,1/18/22
1018,Using Instance Metadata and Trusted Profiles for Managing SSH Keys,https://www.ibm.com/cloud/blog/using-instance-metadata-and-trusted-profiles-for-managing-ssh-keys,1/10/22
1019,The Basics of Business Process Modeling and Notation (BPMN),https://www.ibm.com/cloud/blog/bpmn,1/6/22
1020,Truck Tracker: An IoT Pattern Using IBM Cloud Services,https://www.ibm.com/cloud/blog/truck-tracker-an-iot-pattern-using-ibm-cloud-services,1/6/22
1021,What Is Optical Character Recognition (OCR)?,https://www.ibm.com/cloud/blog/optical-character-recognition,1/5/22